"Pipe of Insight","Support","3100","60","100","A powerful artifact of mysterious origin, it creates barriers against magical forces.","Active: Barrier - Gives a shield that blocks 400 spell damage to all allies in a 900 radius.\nPassive: Insight Aura - Gives allied units 4 health regeneration and 10% magic resistance in a 900 radius.","+ 8 HP Regeneration\n+ 30% Spell Resistance\nAURA HEALTH REGEN: 4\nAURA MAGIC RESISTANCE: 10%\nAURA RADIUS: 900\nBARRIER SPELL BLOCK: 400\nBARRIER DURATION: 12.000000\nBARRIER CAST RADIUS: 900","pipe","3","recipe","hood_of_defiance","headdress"
"Phase Boots","Common","1240","8","","Boots that allow the wearer to travel between the ether.","Active: Phase - Gives increased movement speed and lets you move through units.  The increased movement speed is based on whether the equipped hero is melee or ranged.\n\nFlat movement speed bonuses from multiple pairs of boots do not stack.","+ 45 Movement Speed\n+ 24 Damage\nPHASE MOVE BOOST MELEE: 24%\nPHASE MOVE BOOST RANGED: 20%\nPHASE DURATION: 2.5","phase_boots","3","boots","blades_of_attack","blades_of_attack"
"Black King Bar","Armor","3975","80","","A powerful staff imbued with the strength of giants.","Active: Avatar - Grants Spell Immunity and 100% Magic Damage Resistance.  Duration and cooldown decrease with each use.  Some abilities are able to disable through Avatar.","+ 10 Strength\n+ 24 Damage\nAVATAR DURATION: 10/9/8/7/6/5","black_king_bar","3","recipe","ogre_axe","mithril_hammer"
"Bottle","Consumables","660","","","An old bottle that survived the ages, the contents placed inside become enchanted.","Use: Regenerate - Consumes a charge to restore Health and Mana over time. Healing stops if attacked.  Bottle can be refilled at your team's fountain.  Runes can be stored in the Bottle for later use, and are activated automatically after 2 minutes.  If Bottle does not have full charges and is placed on a courier, the courier will move 30% slower.\n\nHold Control to use Regenerate on an allied hero.  Stored runes cannot be shared.","HEALTH RESTORED: 90\nMANA RESTORED: 60\nDURATION: 2.5","bottle","0",""
"Blade of Alacrity","Attributes","1000","","","A long blade imbued with time magic.","","+ 10 Agility","blade_of_alacrity","0",""
"Gauntlets of Strength","Attributes","150","","","Studded leather gloves that add brute strength.","","+ 3 Strength","gauntlets","0",""
"Mekansm","Support","2275","65","225","A glowing jewel formed out of assorted parts that somehow fit together perfectly.","Active: Restore - Heals 250 health and gives +2 armor to allied units in a 900 radius.\nPassive: Mekansm Aura - Grants 4 health regeneration to allied units in a 900 radius.\n\nMultiple instances of Mekansm Aura do not stack.","+ 5 All Attributes\n+ 5 Armor\nAURA HEALTH REGEN: 4\nRESTORE HEAL: 250\nRESTORE ARMOR: 2\nRESTORE ARMOR DURATION: 25\nAURA/RESTORE RADIUS: 900","mekansm","3","recipe","headdress","buckler"
